细分类,英文,可视化目的,视觉定义,适用场景,数据特征,code,extraction
圆环进度图,Circular Progress Chart,比较,"在圆环形状基础上,使用填充弧长来表示进度或比例的数据可视化图表,常用不同颜色区分已完成和未完成部分",展示任务完成进度、目标达成率、资源使用占比等单一指标的完成情况;适合在仪表盘或数据大屏中作为关键指标展示,"单一数值型指标,通常为百分比形式(0-100%)",Matplotlib,1
折线-柱状图,Line-Column Combination Chart,"比较,分布,趋势","在同一个坐标系中,将折线图和柱状图结合展示,通常使用双Y轴,一边用柱形显示一组数据,另一边用折线显示另一组数据","需要同时对比分析两种不同量级或不同性质的数据变化趋势时,比如销售额(柱形)和增长率(折线)的对比,或者收入(柱形)和利润率(折线)的关系分析","包含两组相关但量级或度量单位不同的数据系列,通常具有共同的时间维度或分类维度,一组适合用量值展示,另一组适合用趋势展示",Plotly,1
折线-面积图,Line-Area Combination Chart,"比较,分布,趋势","结合折线图和填充面积图,面积填充强调数值规模",展示趋势同时强调数值体量、显示累计效应、对比趋势和规模,"包含连续型时间序列数据,需要同时关注趋势和规模",Plotly,1
双Y轴折线图,Dual Y-Axis Line Chart,"比较,趋势",使用两个Y轴分别绘制不同量级或单位的折线,比较不同量级指标的变化趋势、分析指标相关性、对比不同单位的指标,包含两组不同量级或单位的时间序列数据,Plotly,1
双Y轴柱状图,Dual Y-Axis Bar Chart,"比较,分布",在同一图表中使用两个Y轴，一个在左侧，一个在右侧，可以同时展示两组具有不同量级或单位的数据,需要比较两组具有不同数量级或不同度量单位的相关数据时，如同时展示销售额（元）和销售量（件），或者温度（℃）和降雨量（mm）等,两组数据具有共同的X轴类别，但Y轴数值范围或单位不同；两组数据之间存在某种关联性，需要进行对比或分析,Plotly,1
多子图柱状图,Multiple Subplot Bar Chart,"比较,分布",将多个独立的柱形图按照一定布局规则（如上下、左右或网格）组合在一起展示，每个子图可以包含不同的数据系列和比较对象,需要在同一页面展示多个相关但独立的数据对比分析，如不同地区的销售数据对比、多个产品的性能指标比较、不同时期的数据趋势对比等,数据集包含多个独立的系列，每个系列都有自己的分类变量和对应的数值变量，各系列之间可能存在关联但相对独立，适合分别展示并进行整体比较,Plotly,1
多子图面积图,Multiple Subplot Area Chart,"比较,趋势","将多个面积图按行列布局排列在同一画布中,每个子图展示一个不同的面积关系,子图间可以共享坐标轴",需要同时对比多个不同指标或维度的面积趋势变化;不同数据集之间存在关联但又需要分开展示;展示多个时间序列数据的累积效应,"多组时序数据,每组数据都包含连续的时间维度和对应的数值;数据集之间有一定关联性但各自独立;各组数据的数值范围可能不同",Plotly,1
多子图折线图,Multiple Subplot Line Chart,"比较,趋势","由多个独立的折线图子图组成,每个子图可以展示不同维度或主题的折线趋势,子图之间保持布局的一致性和关联性",需要在一个视图中对比多个相关但独立的时间序列数据;展示同一指标在不同维度下的变化趋势;分析多个变量之间的相关性和差异,包含多组时间序列数据;每组数据都有独立的时间维度和数值维度;数据之间存在一定的关联性但又相对独立;各组数据的观测频率和时间跨度相近,Plotly,1
多子图饼图,Multiple Subplot Pie Chart,"比较,组成","由多个独立的饼图子图组成,每个饼图展示不同维度或时期的占比分布情况,子图之间保持布局的规整性和视觉上的关联性",需要在同一视图中对比多个相关但独立的占比分布;展示同一指标在不同时期的结构变化;分析多个分类变量的构成差异;对比不同群体或地区的构成比例,包含多组分类数据及其对应的数值;每组数据都能构成完整的100%比例;各组数据有相似的分类维度但具体占比不同;数据需要有明确的分组标准如时间、地区或人群等,Plotly,1